{
  "$schema": "http://json-schema.org/draft-07/schema#",
  "type": "object",
  "required": ["layer", "role", "storage", "created_at", "description"],
  "additionalProperties": false,
  "properties": {
    "layer": { "const": "silver" },
    "role": { "type": "string", "minLength": 1 },
    "storage": {
      "type": "object",
      "required": ["format", "layout", "path_pattern", "table_patterns"],
      "additionalProperties": true,
      "properties": {
        "format": { "const": "duckdb" },
        "layout": { "type": "string", "minLength": 1 },
        "path_pattern": { "type": "string", "minLength": 1 },
        "table_patterns": { "type": "object" }
      }
    },
    "authoritative_state": { "type": "object" },
    "created_at": { "type": "string", "minLength": 1 },
    "description": { "type": "string", "minLength": 1 }
  }
}
